{
  "artifact_type": "node-readback",
  "base_sha": "aad17d28be539c88ecef4b9fbaf3eaa08f59461b",
  "branch": "feature/scrum-263-node-instruction-evidence-ledger",
  "head_sha": "e927420d8619bc9b45fda1e15d9ff9f374dc01db",
  "idempotency_key": "SCRUM-263:scrum-263-g2-20260802T144100Z:gate_authority.gate-transition-decision",
  "node_id": "gate_authority.gate-transition-decision",
  "occurred_at": "2026-08-02T14:41:00Z",
  "payload": {
    "diff_readback": {
      "additions": 33,
      "base_sha": "aad17d28be539c88ecef4b9fbaf3eaa08f59461b",
      "branch": "feature/scrum-263-node-instruction-evidence-ledger",
      "changed_paths": [
        ".gwc/tasks/SCRUM-263/g0/context-snapshot.yaml",
        ".gwc/tasks/SCRUM-263/g1/brainstorming/g1-options.yaml",
        ".gwc/tasks/SCRUM-263/g1/decision/g1-decision-record.yaml",
        ".gwc/tasks/SCRUM-263/g1/intake/g1-intake-brief.yaml",
        ".gwc/tasks/SCRUM-263/g1/preflight/g1-preflight-report.yaml",
        ".gwc/tasks/SCRUM-263/g2/action-packets/create-commit.yaml",
        ".gwc/tasks/SCRUM-263/g2/action-packets/create_guarded_branch_or_worktree.yaml",
        ".gwc/tasks/SCRUM-263/g2/action-packets/modify-approved-files.yaml",
        ".gwc/tasks/SCRUM-263/g2/action-packets/push-working-branch.yaml",
        ".gwc/tasks/SCRUM-263/g2/execution-envelope.yaml",
        ".gwc/tasks/SCRUM-263/g2/plan-read-receipt.yaml",
        ".kiro/specs/scrum-263-node-instruction-evidence-ledger/design.md",
        ".kiro/specs/scrum-263-node-instruction-evidence-ledger/requirements.md",
        ".kiro/specs/scrum-263-node-instruction-evidence-ledger/tasks.md",
        "core/node-architect/GATE_NODE_RUNTIME_BINDING_CONTRACT_v1.0.md",
        "core/node-architect/NODE_INSTRUCTION_CONTRACT_v1.0.md",
        "core/node-architect/gate-node-route-profile.json",
        "core/node-architect/node-instructions/gate_authority/gate-state-resolution.node-instruction.yaml",
        "core/node-architect/node-instructions/gate_authority/gate-transition-decision.node-instruction.yaml",
        "core/node-architect/node-instructions/repo_delivery/diff-readback.node-instruction.yaml",
        "core/node-architect/node-instructions/repo_delivery/scoped-file-write.node-instruction.yaml",
        "projects/gwc/project-extension.md",
        "releases/changelog.d/2026-08-02-node-instruction-evidence-ledger.md",
        "schemas/node-architect/gate-node-route-decision.schema.json",
        "schemas/node-architect/gate-node-route-profile.schema.json",
        "schemas/node-architect/node-instruction.schema.json",
        "schemas/node-architect/node-runtime-evidence.schema.json",
        "tests/test_gate_node_route_resolution.py",
        "tests/test_node_evidence_ledger.py",
        "tests/test_node_instruction_contract.py",
        "tools/node_architect/node_evidence_ledger.py",
        "tools/node_architect/resolve_gate_node_route.py",
        "tools/node_architect/validate_node_instruction.py"
      ],
      "decision_digest": "sha256:6f1c03a3777351186818ac7dcc988926670307975c291698588c62b31cc1c25d",
      "deletions": 0,
      "deployment_authority_granted": false,
      "head_sha": "e927420d8619bc9b45fda1e15d9ff9f374dc01db",
      "merge_authority_granted": false,
      "outcome": "PASS",
      "production_authority_granted": false,
      "reason_codes": [
        "DIFF_READBACK_OK"
      ],
      "repository": "nhatnguyenquang1838-coder/gwc"
    },
    "head_sha": "e927420d8619bc9b45fda1e15d9ff9f374dc01db",
    "outcome": "PASS"
  },
  "record_digest": "sha256:c237ed759a1cbd68c8486e41b7838a76fc1e87c12ee3579d8be431709d991f07",
  "repository": "nhatnguyenquang1838-coder/gwc",
  "run_id": "scrum-263-g2-20260802T144100Z",
  "schema_version": "1.0",
  "scope_hash": "sha256:a5807aeaa976988d4bee9db3eac9a38276a6b87d6381f5aa5ba1d80ba772f43e",
  "sequence": 4,
  "state_digest": "sha256:f5692a336ec1ce58f0f088e8576e108ec411264f0d335c8d662cb67540461f37",
  "task_id": "SCRUM-263"
}
