{
  "artifact_type": "node-decision",
  "base_sha": "aad17d28be539c88ecef4b9fbaf3eaa08f59461b",
  "branch": "feature/scrum-263-node-instruction-evidence-ledger",
  "decision_digest": "sha256:9b678ba64cd2705d59e3b9601a20d31d88da07585fac6c054006a21c931213d2",
  "head_sha": "e927420d8619bc9b45fda1e15d9ff9f374dc01db",
  "idempotency_key": "SCRUM-263:scrum-263-g2-20260802T144100Z:gate_authority.gate-transition-decision",
  "node_id": "gate_authority.gate-transition-decision",
  "occurred_at": "2026-08-02T14:41:00Z",
  "payload": {
    "artifact_type": "gate-node-route-decision",
    "authority_granted": false,
    "current_node": "gate_authority.gate-transition-decision",
    "decision_digest": "sha256:aa9649c1da6501b8064557e4a828d00204ddbaef891269362d74009436092da0",
    "deployment_authority_granted": false,
    "evidence_contract_valid": true,
    "gate": "G2_EXECUTION",
    "graph_revision": "scrum-104-20260726",
    "implementation": {
      "kind": "resolver",
      "ref": "tools/node_architect/resolve_gate_node_route.py:resolve_gate_node_route"
    },
    "instruction_digest": "sha256:e899abee3e0ee3ffcaa25946ebfd751bb625b475fc139c23ad53e58f9bd3dbcf",
    "instruction_validated": true,
    "loaded_context": [
      "approval_receipt",
      "base_sha_readback",
      "diff_readback",
      "g0_context",
      "g1_decision",
      "g2_envelope",
      "task_claim",
      "write_result"
    ],
    "log_contract_valid": true,
    "merge_authority_granted": false,
    "mode_runtime_required": true,
    "next_action": null,
    "next_gate": "G3_PR",
    "next_node": null,
    "next_route_contract_valid": true,
    "node_instruction_ref": "core/node-architect/node-instructions/gate_authority/gate-transition-decision.node-instruction.yaml",
    "outcome": "ROUTE_SELECTED",
    "pr_authority_granted": false,
    "production_authority_granted": false,
    "profile_id": "gwc-gate-node-runtime-binding",
    "profile_revision": "scrum-263-20260802-r1",
    "reason_code": "ROUTE_SELECTED",
    "reason_codes": [
      "ROUTE_SELECTED"
    ],
    "requested_action": "resolve_gate_transition",
    "required_context": [
      "g0_context",
      "g1_decision",
      "g2_envelope",
      "approval_receipt",
      "task_claim",
      "base_sha_readback",
      "write_result",
      "diff_readback"
    ],
    "route_id": "g2-resolve-g3-boundary",
    "schema_version": "1.1",
    "task_id": "SCRUM-263",
    "workflow_mode": "normal",
    "write_authority_granted": false
  },
  "record_digest": "sha256:44a5e5ef8c1232f481a3e2d51da8953ba04928be13abc59089b2181764112153",
  "repository": "nhatnguyenquang1838-coder/gwc",
  "run_id": "scrum-263-g2-20260802T144100Z",
  "schema_version": "1.0",
  "scope_hash": "sha256:a5807aeaa976988d4bee9db3eac9a38276a6b87d6381f5aa5ba1d80ba772f43e",
  "sequence": 2,
  "state_digest": "sha256:127537d81aef93b198e3ae065f8333010655311e3ceb981957480d86e2b5574d",
  "task_id": "SCRUM-263"
}
