{
  "artifact_type": "node-start",
  "base_sha": "aad17d28be539c88ecef4b9fbaf3eaa08f59461b",
  "branch": "feature/scrum-263-node-instruction-evidence-ledger",
  "head_sha": "e927420d8619bc9b45fda1e15d9ff9f374dc01db",
  "idempotency_key": "SCRUM-263:scrum-263-g2-20260802T144100Z:gate_authority.gate-state-resolution",
  "node_id": "gate_authority.gate-state-resolution",
  "occurred_at": "2026-08-02T14:41:00Z",
  "payload": {
    "gate": "G2_EXECUTION",
    "instruction_digest": "sha256:219602969d43871a702002e38fcedb4831a237dc182676f734ce4c16e58e7df4",
    "requested_action": "resolve_execution_node",
    "status": "STARTED"
  },
  "record_digest": "sha256:98fd3544de590c7d953e3f8c5e9b7ec831dcca30a4ab7359b1b0c79969d555e8",
  "repository": "nhatnguyenquang1838-coder/gwc",
  "run_id": "scrum-263-g2-20260802T144100Z",
  "schema_version": "1.0",
  "scope_hash": "sha256:a5807aeaa976988d4bee9db3eac9a38276a6b87d6381f5aa5ba1d80ba772f43e",
  "sequence": 1,
  "state_digest": "sha256:e061342fe20efcacb8e2094e645145a6e0fc719fa516867462991cc3946a44a5",
  "task_id": "SCRUM-263"
}
