{
  "artifact_type": "node-result",
  "base_sha": "aad17d28be539c88ecef4b9fbaf3eaa08f59461b",
  "branch": "feature/scrum-263-node-instruction-evidence-ledger",
  "head_sha": "e927420d8619bc9b45fda1e15d9ff9f374dc01db",
  "idempotency_key": "SCRUM-263:scrum-263-g2-20260802T144100Z:repo_delivery.scoped-file-write",
  "node_id": "repo_delivery.scoped-file-write",
  "occurred_at": "2026-08-02T14:41:00Z",
  "payload": {
    "implementation_effect": "approved_repository_write",
    "outcome": "PASS",
    "reason_codes": [
      "NODE_EXECUTION_EVIDENCE_RECONCILED"
    ]
  },
  "record_digest": "sha256:474979dc1c97d70fbfd8292af3cb20137c9e52110bd364d655c99bda7882b2f2",
  "repository": "nhatnguyenquang1838-coder/gwc",
  "run_id": "scrum-263-g2-20260802T144100Z",
  "schema_version": "1.0",
  "scope_hash": "sha256:a5807aeaa976988d4bee9db3eac9a38276a6b87d6381f5aa5ba1d80ba772f43e",
  "sequence": 3,
  "state_digest": "sha256:767f28c720462481885e0399d2699eace6bd1f912a128f16e83c7578e9bb9c4c",
  "task_id": "SCRUM-263"
}
