{
  "artifact_type": "node-decision",
  "base_sha": "aad17d28be539c88ecef4b9fbaf3eaa08f59461b",
  "branch": "feature/scrum-263-node-instruction-evidence-ledger",
  "decision_digest": "sha256:4f1fc86452ebea4cbd3a3306e7a974a20c85b359966548a50b6901439c1fa756",
  "head_sha": "e927420d8619bc9b45fda1e15d9ff9f374dc01db",
  "idempotency_key": "SCRUM-263:scrum-263-g2-20260802T144100Z:repo_delivery.diff-readback",
  "node_id": "repo_delivery.diff-readback",
  "occurred_at": "2026-08-02T14:41:00Z",
  "payload": {
    "artifact_type": "gate-node-route-decision",
    "authority_granted": false,
    "current_node": "repo_delivery.diff-readback",
    "decision_digest": "sha256:5acc2c263e6df62ff38e7fb03d3a3701565e6a68cbb79941c92ec8d1bf61f959",
    "deployment_authority_granted": false,
    "evidence_contract_valid": true,
    "gate": "G2_EXECUTION",
    "graph_revision": "scrum-104-20260726",
    "implementation": {
      "kind": "connector",
      "ref": "GitHub.compare_commits"
    },
    "instruction_digest": "sha256:627dd5faeedcd0cd5852258be0d3659648c70a663cc024d0926ada083c225c30",
    "instruction_validated": true,
    "loaded_context": [
      "approval_receipt",
      "base_sha_readback",
      "g0_context",
      "g1_decision",
      "g2_envelope",
      "task_claim",
      "write_result"
    ],
    "log_contract_valid": true,
    "merge_authority_granted": false,
    "mode_runtime_required": true,
    "next_action": "resolve_gate_transition",
    "next_gate": null,
    "next_node": "gate_authority.gate-transition-decision",
    "next_route_contract_valid": true,
    "node_instruction_ref": "core/node-architect/node-instructions/repo_delivery/diff-readback.node-instruction.yaml",
    "outcome": "ROUTE_SELECTED",
    "pr_authority_granted": false,
    "production_authority_granted": false,
    "profile_id": "gwc-gate-node-runtime-binding",
    "profile_revision": "scrum-263-20260802-r1",
    "reason_code": "ROUTE_SELECTED",
    "reason_codes": [
      "ROUTE_SELECTED"
    ],
    "requested_action": "post_write_readback",
    "required_context": [
      "g0_context",
      "g1_decision",
      "g2_envelope",
      "approval_receipt",
      "task_claim",
      "base_sha_readback",
      "write_result"
    ],
    "route_id": "g2-post-write-diff-readback",
    "schema_version": "1.1",
    "task_id": "SCRUM-263",
    "workflow_mode": "normal",
    "write_authority_granted": false
  },
  "record_digest": "sha256:fa925a4b44e9664ae1801171446aa4bd10b3247d5c779d705240ab211f3df002",
  "repository": "nhatnguyenquang1838-coder/gwc",
  "run_id": "scrum-263-g2-20260802T144100Z",
  "schema_version": "1.0",
  "scope_hash": "sha256:a5807aeaa976988d4bee9db3eac9a38276a6b87d6381f5aa5ba1d80ba772f43e",
  "sequence": 2,
  "state_digest": "sha256:01c86ebb19ef738582c1af733d24435bef106aa1b8f24b8bbb7b818f617005d4",
  "task_id": "SCRUM-263"
}
