{
  "artifact_type": "next-route-decision",
  "base_sha": "aad17d28be539c88ecef4b9fbaf3eaa08f59461b",
  "branch": "feature/scrum-263-node-instruction-evidence-ledger",
  "decision_digest": "sha256:be483d6bb48b76179851ac4f5c0b61b147ca2fe07e64229e91f6ef2b32f32a75",
  "head_sha": "e927420d8619bc9b45fda1e15d9ff9f374dc01db",
  "idempotency_key": "SCRUM-263:scrum-263-g2-20260802T144100Z:repo_delivery.diff-readback",
  "node_id": "repo_delivery.diff-readback",
  "occurred_at": "2026-08-02T14:41:00Z",
  "payload": {
    "authority_granted": false,
    "next_action": "resolve_gate_transition",
    "next_gate": null,
    "next_node": "gate_authority.gate-transition-decision",
    "outcome": "PASS"
  },
  "record_digest": "sha256:a87eabea9cf84a762d4e50708d7ebf073f95a748082f622ee8abcd76227200ed",
  "repository": "nhatnguyenquang1838-coder/gwc",
  "run_id": "scrum-263-g2-20260802T144100Z",
  "schema_version": "1.0",
  "scope_hash": "sha256:a5807aeaa976988d4bee9db3eac9a38276a6b87d6381f5aa5ba1d80ba772f43e",
  "sequence": 6,
  "state_digest": "sha256:e88af2bf1e8136d8aeaf8c5e866873889f157d9fb404ee0cad0b036b23aa81c5",
  "task_id": "SCRUM-263"
}
